"Date","Commenter","Submitter","Pull ID","Text"
"2016-03-31T21:35:31.536Z","Brett","Bruce","337","Can we move this statement under try block? Because of any reason say some security reasons, security exceptions thrown then it won't let application to come up. It's better we catch and log exception and move on."
"2015-10-07T16:59:50.644Z","Ralph","Tom","68","Bruce's checkin has caused a merge conflict in v1/common/SvtObjectCommonUtils.java.  Thang, can you address the conflict?"
"2015-10-07T16:39:56.093Z","Brett","Tom","68","Correct me if I am wrong. But can we remove tomcat7 from path for LOG_FILE? As of now we are running tomcat7, but in future we will upgrade tomcat and at that time it doesn't make any sense for this path. Irrelevant of version we never change location for log to avoid confusion. So can we give specific name like /var/log/rest-api/svt-rest-api.log? Or can we drop the files under /var/log/ only?"
"2015-10-07T13:52:37.966Z","Brett","Tom","68","Please remove e.printStackTrace() and log into logger file."
"2015-10-07T13:51:07.097Z","Brett","Tom","68","Please remove e.printStackTrace(). Instead log everything in logger file."
"2016-01-11T18:39:22.283Z","Brett","Bruce","170","Same here and down below as well."
"2016-01-11T18:38:12.363Z","Brett","Bruce","170","Now we don't need this validation here."
"2016-01-11T18:11:57.322Z","Ralph","Bruce","170","I'm satisfied that with the latest changes we will be validating the user input from a syntactical POV within the controller before the MO is passed to the service for further processing."
"2016-01-08T18:24:50.961Z","Ralph","Bruce","170","Here's my two cents on the ""where should we validate inputs"" discussion:  I do like the idea of having syntactical validation (e.g., is the input provided just plain wrong for the targeted task?) being done in the controller, because it does fit with the responsibility of the controller.  This does not mean that the service doesn't have to do any validation, but what it would validate is different.  It should validate things that only the service can (given its ability to interact with the system underneath it), which we can call semantics.  I guess what I'm saying is that, in our situation, the controller is responsible for making sure that the MO that gets sent to the service is formed correctly, but it will be the service that has to make sure that the information contained in the MO is valid for what is being done.   This is similar to the division-of-labor when doing XML processing where the parser will validate the structure, but the processor will validate that the input makes sense.  
What I'm not sold on is the benefits of having this validation done within a Spring-based Validator.  Without knowing all of the details of what a Validator-based actually provides, when I did the Backup rewrite I really wanted to just write a private validation method within the controller to deal with the data that was gathered.  The code that I ended up checking in basically bypasses any benefits of being part of a Validator.  So going forward if we do put syntactical validation in the controller (which I think is a good thing), should we bother with leveraging the Spring Validator hooks?  I don't think so."
"2016-01-08T16:20:49.459Z","Ralph","Bruce","170","I could argue that this new code should be copyrighted ""2016"""
"2016-01-07T20:12:43.193Z","Brett","Bruce","170","Why are you moving validator code to service class? It is violating the controller rule. Because it is controller duty to validate request not service."
"2015-09-09T17:52:51.070Z","Tom","Brett","36","There are some nit picks I pointed out, but nothing to down vote on.  It does bring up the question of styling because there are several inconsistencies in the new code with respect to spacing and newlines.  Maybe we should adopt the SimpliVity template for this project.  Whether I like it or not, I rather have consistent code and having code formatted before check-in would be good."
"2015-09-09T17:50:19.203Z","Tom","Brett","36","if (te.getErrorCode() == 10) {"
"2015-09-09T17:48:07.194Z","Tom","Brett","36","All of the new lines that were in the original code got removed.  I really do not understand why, because it makes it a bit harder to separate logic.  Just a comment - you should keep the original new lines that were there."
"2015-09-09T17:02:56.622Z","Tom","Brett","36","Should it be a null return or an IllegalArgumentException?"
"2015-09-09T16:58:54.942Z","Tom","Brett","36","if (control != null) {"
"2015-09-09T16:57:07.696Z","Tom","Brett","36","Same here - leave the control and sessions in createPolicy."
"2015-09-09T16:56:33.551Z","Tom","Brett","36","You should leave the control and sessions inside createPolicyRule, until we move them to the controller at a later time.  This just makes it consistent."
"2015-09-09T16:54:44.628Z","Tom","Brett","36","Extra spaces between the comma and PolicyRuleMO."
"2015-09-09T16:53:41.488Z","Tom","Brett","36","Did you delete the metrics folder?  I do not see it in this commit."
"2015-09-09T16:51:53.562Z","Tom","Brett","36","nit: s/field/fields/"
"2015-09-09T16:49:59.693Z","Tom","Brett","36","nit: Should it be in the same order as performBackupOperation?  performBackupOp(bkpId, bmo);  You are calling it a different name, performBackupOp, so it should not be overloading the method."
"2015-09-09T13:07:17.764Z","Ralph","Brett","36","I really like the restructuring and grouping of the code.  I think that it is now a bit easier to visualize the flow of control that a request will go through.  Good job!  Please address the comments at your earliest convenience.  "
"2015-09-09T13:01:46.515Z","Ralph","Brett","36","""Datastore"" is one whole word, so all references to them should be as ""Datastore"" and not ""DataStore"""
"2015-09-09T13:00:29.234Z","Ralph","Brett","36","For consistency with other references to the concept of a datastore, instead of ""DataStore"" it should be ""Datastore"" throughout the code.  "
"2015-09-09T11:37:26.497Z","Tom","Brett","36","s/setPolicy/createPolicy/"
"2015-09-09T11:20:51.157Z","Tom","Brett","36","s/setVirtualMachineAction/performVirtualMachineOperation/"
"2015-09-09T11:19:10.908Z","Tom","Brett","36","Use singular form.  You can only delete one rule at a time."
"2015-09-09T11:18:54.877Z","Tom","Brett","36","Use singular form.  You can only update one rule at a time."
"2015-09-09T11:18:06.884Z","Tom","Brett","36","You only create one rule at a time.  It should be createPolicyRule (not plural and not prefix with set)."
"2015-09-09T11:16:26.170Z","Tom","Brett","36","The create operations should be consistent in naming with others.  You should rename it ""createDatastore"".  A set operation includes more than just create sometimes.  It can include backup, restore, clone, etc. (not for this object of course).  The method name should be named appropriately."
"2015-09-09T11:13:52.034Z","Tom","Brett","36","The name ""setBackupDetails"" is confusing.  It is not actually setting any details on the backup.  It is performing an action, e.g. rename or restore.  You should rename it to ""performBackupOperation""."
"2015-09-09T11:07:49.351Z","Tom","Brett","36","There should be a plural and singular form of each object.  Plural form should be the key returned on lists and singular should be returned on get by id."
"2015-09-09T02:37:03.051Z","Tom","Brett","36","Can we create a generic service class that has the standard methods that objects need, e.g. getAll, getById, create (or set), and delete?  Any object that has one-off methods can reside in the specific service implementation itself.  This way, we can remove all the specific I<Object>Service.java (might not be possible in Spring since you have to AutoWire an interface) and consolidate the code base.  For example,

public interface IService {
    Map<String, Object> getAll(String field, int limit, int offset, String sort, String order) throws TException, TaskException;
    Map<String, Object> getById(String id) throws TException, TaskException;
    Map<String, Object> create(Object mo) throws TException, TaskException;
    Map<String, Object> performOperation(String id, Object mo) throws ObjectNotFoundException, TException, TaskException;
    Map<String, Object> delete(String id) throws TaskException, TException;
}

There are objects, i.e. tasks, that we could not implement all the methods for (i.e. getAll).  For those, we can just return NotImplementedException.

We do not have to do it in this patch, but it might be worthwhile in a follow up patch."
"2015-09-09T02:26:47.721Z","Tom","Brett","36","The package name should be in lower-case, i.e. mo.  See https://docs.oracle.com/javase/tutorial/java/package/namingpkgs.html - ""Package names are written in all lower case to avoid conflict with the names of classes or interfaces."""
"2015-09-09T02:21:15.368Z","Tom","Brett","36","The response should be ""backups"" since it is a list of backups.  This applies to the other objects too.  When returning multiple objects, we should use the plural form."
"2015-09-08T19:01:47.033Z","Bruce","Brett","36","I don't think these two comment lines apply anymore, since we now return all the fields in the MO."
"2015-09-08T19:01:00.332Z","Bruce","Brett","36","Do we still need the detail parameter?  "
"2016-03-21T21:58:11.034Z","Bruce","Karen","318","I think we want people to run the entire suite by default - making sure all the tests pass.  TestRunner has a main method to run the entire TestSuite (which deletes the test_results.log before running it).  In Eclipse, I usually right click on TestSuite and run as JUnit to reset the file and run all the tests.  

Will that still work correctly?"
"2016-03-21T21:53:28.986Z","Bruce","Karen","318","Could you fill in this section as well.  Thanks,"
"2016-03-21T20:31:51.854Z","Bruce","Karen","318","Looks like all of these system parameters need to be passed in via the command line or the tests will fail, right?  

Can you validate them and print an error message if any are missing and stop the tests?

Also, can you update the rest-automation/readme.md with instructions on how to build and run rest-automation.  That should help."
"2016-03-21T20:29:27.742Z","Ralph","Karen","318","Since we're still going to want to run the tests from Eclipse, couldn't we still keep these properties around, but override them if information is provided as arguments on the command line?"
